LON,LAT,resource_type,org_name,address,contact_1,contact_2,phone,email,optional_1
-86.259011,36.901737,Shared Equipment,Warren County Cattle Producers Association,"1238 Claypool Alvaton Road, Bowling Green, KY 42103",Shane Wahl,Director,(270) 779-6078,dl_ces_warren@email.uky.ed,"Chain Harrow, Sprayer"
-85.2242075,37.700355,Shared Equipment,Washington County Conservation District,"461 Lincoln Drive, Springfield, KY 40069",Dana Shewmaker,Administrative Secretary,(859) 336-7777,Dana.shewmaker@ky.nacdnet.net,"Lime Spreader, Sprayer"
-85.2226901,37.6834908,Shared Equipment,Washington County Farm Bureau,"100 E Depot St, Springfield, KY 40069",Jeremy Hardin,Agency Manager,(859) 336-9472,[none],Manure Spreader
-83.5456925,37.7346387,Shared Equipment,Wolfe County Soil Conservation District ,"Main Street, Campton, KY 41301",Kevin Hileman,,(606) 668-3111,,"Lime Spreader, Manure Spreader, Chain Harrow, No-Till Drill, Aerator"
-84.7581091,38.0477522,Shared Equipment,Woodford County Conservation District,"180 Beasley Road, Versailles, KY 40383",Jimmy Chambers,Administrative Secretary,(859) 873-4941,woodfordcd@gmail.com,No-Till Drill
-84.5340316,37.9776483,University of Kentucky Resource,Horticulture Research Farm (UKHRF),"4321 Emmert Farm Lane, Lexington, KY  40514",,,(859) 948-3614,,https://research.ca.uky.edu/content/SouthFarm
-87.8588905,37.097932,University of Kentucky Resource,Research and Education Center at Princeton (UKREC),"348 University Drive, Princeton, KY 42445",,,(270) 365-7541,,https://wkrec.ca.uky.edu/
-83.3496353,37.5330605,University of Kentucky Resource,Robinson Center for Appalachian Resource Sustainability (RCARS),"176 Robinson Road, Jackson, KY 41339",,,(606) 666-2438,robinson.center@uky.edu,https://rcars.ca.uky.edu/
